A5032990245,Jasmin Aldag,,4,49,0,3,3,Euroimmun Medizinische Labordiagnostika (Germany),"Genetics, Biochemistry, RNA, Biology, Gene, Chemistry, Transfer RNA, Organic chemistry, Stereochemistry, Medicine, Physics, Internal medicine, Surgery, Wobble base pair, DNA, Immune system, Genetic code, Combinatorial chemistry, Nuclear magnetic resonance, Speed wobble, Acute-phase protein, Nucleobase, Quantum mechanics, Computational biology, Classical mechanics"
A5033390652,Stephanie Costa,,4,117,0,1,1,Thomas Jefferson University,"Sociology, Political science, Anthropology, Mathematics, Computer science, Genetics, Medicine, Biology, Environmental health, Ethnic group, Demography, Law, Population, Statistics, Epidemiology, Machine learning, Cancer, Internal medicine, Pathology, Logistic regression, Odds ratio, Cancer registry, Surveillance, Epidemiology, and End Results, Pacific islanders, Genetic code"
A5033544417,Nediljko Budisa,,4,0,0,0,0,University of Manitoba,"Genetics, Biochemistry, Biology, Gene, Chemistry, Amino acid, Physics, Organic chemistry, Genetic code, Biophysics, Nuclear magnetic resonance, Quantum mechanics, RNA, Photochemistry, Fluorescence, Optics, Green fluorescent protein, Transfer RNA, Chromophore, DNA, Protein biosynthesis, Antimicrobial, Microbiology, Cell biology, Messenger RNA"
A5033850036,Kubendiran Kumaran,,4,78,0,2,1,Syngene International (India),"Genetics, Biochemistry, Medicine, Biology, Chemistry, Computational biology, Gene, Geology, Paleontology, Bacteria, Traditional medicine, Protein biosynthesis, Extraction (chemistry), Antimicrobial, Genetic code, Agar diffusion test, Psychology, Dermatology, Ecology, Food science, Methylation, Computer science, Docking (animal), Veterinary medicine, Chromatography"
A5034705017,Bar Cohen,,4,27,3.5,3,1,Technion – Israel Institute of Technology,"Mitochondrion, Genetics, Biochemistry, Biology, Cell biology, Gene, Messenger RNA, Molecular biology, Chemistry, RNA, Translation (biology), Protein biosynthesis, Psychology, Colocalization, Nuclear magnetic resonance, Cytosol, Physics, Transfer RNA, Neuroscience, Organic chemistry, Enzyme, Genetic code, Bioinformatics, Axoplasmic transport, Computational biology"
A5036076732,Felix Knote,https://orcid.org/0000-0002-2713-3925,4,2,0,1,0,University of Würzburg,"Biophysics, Genetics, Biochemistry, Quantum mechanics, Biology, Fluorescence, Förster resonance energy transfer, Optics, Physics, Organic chemistry, Chemistry, Materials science, Molecule, Biomolecule, Fluorescence correlation spectroscopy, Fluorescence spectroscopy, Nanotechnology, Biological system, Gene, Genetic code, Fluorescence recovery after photobleaching, Photobleaching, Recombinant DNA, Membrane, Nuclear magnetic resonance"
A5036141579,Maria Siddique,,4,1,0.25,1,0,Muhammad Nawaz Shareef University of Agriculture,"Genetics, Biochemistry, Biology, Gene, Chemistry, Genome, Computer science, Computational biology, Medicine, CRISPR, Optics, Physics, Engineering, Genome editing, Immunology, Genetic code, Psychology, Oil refinery, Operations management, Electronic engineering, Nucleotide diversity, Business process reengineering, Chemical engineering, Effector, Bioinformatics"
A5036552274,Olivia Shade,,4,5,2,1,0,University of Pittsburgh,"Biochemistry, Biology, Chemistry, Organic chemistry, Biophysics, Combinatorial chemistry, Bioconjugation, Genetics, Gene, Nanotechnology, Materials science, Bioorthogonal chemistry, Protein biosynthesis, Genetic code, Electronic engineering, Ubiquitin, Computer science, Nuclear magnetic resonance, Quantum mechanics, Click chemistry, Telecommunications, Cell biology, Messenger RNA, Selectivity, Electrical engineering"
A5036634509,Marla S. Gilreath,,4,159,0,3,3,The Ohio State University,"Genetics, Biochemistry, RNA, Biology, Gene, Transfer RNA, Chemistry, Amino acid, Ribosome, Messenger RNA, Translation (biology), Lysine, Aminoacyl tRNA synthetase, Protein biosynthesis, Genetic code, Stop codon, Elongation, Computational biology, EF-Tu, Evolutionary biology, Ultimate tensile strength, Elongation factor, Aminoacylation, Molecular biology, Composite material"
A5036972176,Kwang-Min Sohn,,4,811,0,3,3,Biomedical Research Institute,"Genetics, Biochemistry, Biology, Gene, Chemistry, Organic chemistry, Psychology, Nuclear magnetic resonance, Physics, Neuroscience, Enzyme, DNA, Genetic code, Algorithm, Plasmid, Mitochondrial DNA, Computer network, Programmed cell death, Mathematics, Linkage disequilibrium, Computer security, Computer science, Linguistics, Chemical engineering, DNA fragmentation"
A5037774299,Tung Yue Wang,,4,103,0,3,2,State University of New York,"Genetics, Biochemistry, Biology, Chemistry, Gene, Algorithm, Mathematics, Computer science, Histone, Physics, Molecular biology, Residual, Amino acid, DNA, Solubilization, Genetic code, Biophysics, Psychology, Ribosomal protein, Linguistics, Nuclear magnetic resonance, RNA, Ribosomal RNA, Medicine, Chromatin"
A5037890008,Landry Cr,,4,1,0,1,0,PROTEO,"Genetics, Biochemistry, Computational biology, Biology, Gene, Chemistry, Medicine, Internal medicine, Genome, Amino acid, Geometry, Genetic code, Protein–protein interaction, Phosphorylation, Connection (principal bundle), Psychology, Mutagenesis, Mathematics, Computer science, Tyrosine kinase, Nuclear magnetic resonance, Open reading frame, Bioinformatics, Signal transduction, Structural engineering"
A5039147222,Iva Stojan,,4,3,0,1,0,Institute of Oceanography and Fisheries,"Genetics, Biology, Chemistry, Biochemistry, Organic chemistry, Ecology, Environmental science, Computational biology, Trophic level, Gene, Oceanography, Physics, Geology, Paleontology, Bacteria, DNA, Cyanobacteria, DNA polymerase, Mediterranean climate, Extraction (chemistry), Picoplankton, Genetic code, Mathematics, Chromatography, Nuclear magnetic resonance"
A5039578669,Sandra Moreira,,4,5,1,1,0,University of Santiago Chile,"Biology, Genetics, Chemistry, Biochemistry, Botany, Medicine, Gene, Food science, Wine, Optics, Physics, Internal medicine, Endocrinology, Art, Visual arts, Organic chemistry, Saccharomyces cerevisiae, Yeast, Antimicrobial, Gene duplication, Genetic code, Stop codon, Open reading frame, RNA, Codon usage bias"
A5039587176,Nikunj Maheshwari,https://orcid.org/0000-0003-3785-3376,4,95,0,4,2,University College Dublin,"Genetics, Biology, Chemistry, Biochemistry, Gene, Food science, Computer science, Nuclear magnetic resonance, Computational biology, Medicine, Microbiology, Physics, Geology, Paleontology, Organic chemistry, Bacteria, Genetic code, Ecology, Combinatorial chemistry, Toxicology, Environmental science, Composition (language), Linguistics, Pulsed-field gel electrophoresis, Veterinary medicine"
A5039660472,Vadim V. Guschin,,4,9,0,1,0,N/A,"Genetics, Biochemistry, Biology, Physics, Chemistry, DNA, Biophysics, Quantum mechanics, Gene, Field (mathematics), Mathematics, Computational biology, Chromatin, Magnetic field, Electron, Organic chemistry, Nuclear physics, Pure mathematics, Quantum electrodynamics, Ring current, Genetic code, genomic DNA, Condensed matter physics, DNA sequencing, Delocalized electron"
A5039682498,Masaharu Fukushima,,4,37,0,2,1,Okayama University,"Genetics, Biochemistry, RNA, Biology, Gene, Messenger RNA, Translation (biology), Transfer RNA, Chemistry, Amino acid, Protein biosynthesis, Genetic code, Open reading frame, Mutant, Molecular biology, Peptide sequence, Base pair, Mutation, Escherichia coli, DNA, Reticulocyte, Eukaryotic translation, Function (biology), Mutagenesis, Stop codon"
A5039773758,Hagai Almagor,,4,137,0,4,3,Hebrew University of Jerusalem,"Genetics, Biochemistry, Biology, Chemistry, Computer science, Computational biology, Gene, DNA, Genetic code, Biophysics, Political science, Information retrieval, Mitochondrial DNA, Mathematics, Linguistics, Chromatography, DNA sequencing, Stereochemistry, Medicine, Dissociation constant, Nucleic acid sequence, Codon usage bias, Coding region, Thermodynamics, Markov chain"
A5040097723,Elizabeth Cowe,,4,856,0,4,3,University of Oxford,"Genetics, Biochemistry, Biology, Gene, Chemistry, Genetic code, Computer science, RNA, Codon usage bias, Genome, Amino acid, DNA, Saccharomyces cerevisiae, Yeast, Astronomy, Political science, Ecology, Key (lock), Computer security, Astrophysics, Botany, Computational biology, Ribozyme, Evolutionary biology, Messenger RNA"
A5040555363,Emst-L Winnacker,,4,116,0,2,2,Analytisches Laboratorium,"Chemistry, Genetics, Biochemistry, Biology, Gene, Oligonucleotide, Materials science, DNA, Combinatorial chemistry, Computer science, Nuclear magnetic resonance, Thermodynamics, Physics, Yield (engineering), Composite material, Organic chemistry, Enzyme, Metallurgy, Phosphoramidite, Deoxyribonucleoside, Solid-phase synthesis, Peptide, Genetic code, Bioinformatics, Computational biology"
A5040624664,Clara I. Bermúdez,,4,46,0,2,2,Universidad Nacional de Colombia,"Mathematics, Combinatorics, Physics, Chemistry, Genetics, Biochemistry, Quantum mechanics, Biology, Gene, Genetic code, Humanities, Political science, Molecule, Computer science, ENCODE, Homogeneous, RNA, Theoretical computer science, Quantum, Graph theory, Politics, Thermodynamics, Hydrogen bond, Discrete mathematics, Statistical physics"
A5040735388,Jack C. Li,,4,67,0,3,2,Scripps Research Institute,"Genetics, Biochemistry, Biology, Gene, Mutant, Organic chemistry, Chemistry, Amino acid, Wild type, Isothiocyanate, Phenylalanine, Proline, Genetic code, Political science, Information retrieval, Computer science, Chemical engineering, Nuclear magnetic resonance, Thermal stability, Quantum mechanics, Adduct, Physics, Engineering, World Wide Web, Protein engineering"
A5042089397,Alma Carolina Sanchez Rocha,,4,118,30,2,1,Charles University,"Genetics, Biochemistry, Computational biology, Biology, Physics, Chemistry, Nuclear magnetic resonance, Gene, Cell biology, Engineering, Philosophy, Organic chemistry, Geography, Amino acid, Crystallography, Genetic code, Computer science, Linguistics, Structural engineering, Stereochemistry, Mechanical engineering, History, Globular protein, Alphabet, Electrical engineering"
A5042160487,Crystal Serrano,,4,7,0,2,0,University of Southern Mississippi,"Genetics, Biochemistry, Biology, Chemistry, Computational biology, Physics, DNA, Biophysics, Nucleic acid, Nuclear magnetic resonance, RNA, Gene, Materials science, Peptide, Crystallography, Branch migration, Genetic code, Computer science, Docking (animal), Veterinary medicine, Structural engineering, Medicine, History, Homologous recombination, Messenger RNA"
A5042200794,N. F. Varney,,4,28,0,2,2,Newcastle University,"Genetics, Biochemistry, Biology, Gene, Physics, Organic chemistry, Chemistry, Nuclear magnetic resonance, Enzyme, Nucleotide, Escherichia coli, Purine, Nucleic acid, RNA, DNA, Genetic code, Auxotrophy, Sensitivity (control systems), RNA editing, Electronic engineering, Condensed matter physics, RNA-dependent RNA polymerase, Linguistics, Quantum mechanics, Polymerase"
A5043105110,Edson Crusca Júnior,,4,16,1.666666667,2,0,Universidade Estadual Paulista (Unesp),"Genetics, Biochemistry, Biology, Chemistry, Nuclear magnetic resonance, Microbiology, Gene, Physics, Geology, Paleontology, Organic chemistry, Bacteria, Antimicrobial, Medicine, Internal medicine, Endocrinology, Molecular biology, Antimicrobial peptides, Peptide, Protein biosynthesis, Crystallography, Genetic code, Biophysics, Lipid bilayer, Membrane"
A5043353438,Christian Diwo,,4,48,3,3,2,Calouste Gulbenkian Foundation,"Genetics, Biology, Computer science, Immune system, Mathematics, Biochemistry, Computational biology, Medicine, Environmental health, Gene, Statistics, Internal medicine, Pathology, Sociology, Demography, Virology, Antibody, Chemistry, Immunology, Infectious disease (medical specialty), Disease, Population, Coronavirus disease 2019 (COVID-19), Astronomy, Genetic code"
A5044595456,Gavriela D. Carver,https://orcid.org/0000-0001-9371-4157,4,91,7,4,4,Broad Institute,"Genetics, Biochemistry, Biology, Gene, Chemistry, RNA, Computational biology, Ribosome, Messenger RNA, Translation (biology), Molecular biology, Transfer RNA, DNA, Coalescent theory, Protein biosynthesis, Extraction (chemistry), Agronomy, Genetic code, Stop codon, Nucleic acid, Computer vision, Ribosomal protein, Computer science, Chromatography, Polymerase chain reaction"
A5044713884,Carey M. James,,4,982,0,4,4,The Ohio State University,"Genetics, Biochemistry, Biology, Gene, Chemistry, Amino acid, DNA, Stop codon, RNA, Organic chemistry, Ecology, Methylation, Open reading frame, Methyltransferase, Geology, Paleontology, Molecular biology, Transfer RNA, Peptide sequence, Methane, Bacteria, Lysine, Methanogenesis, Methanosarcina barkeri, Genetic code"
A5044781058,N. P. Lukashenko,,4,15,0,2,1,Vavilov Institute of General Genetics,"Genetics, Biochemistry, Biology, Gene, Chemistry, Genetic code, Amino acid, DNA, Stop codon, Computer science, Nuclear magnetic resonance, Computational biology, Evolutionary biology, Physics, Genome, Set (abstract data type), Organic chemistry, Enzyme, Programming language, Selenocysteine, Code (set theory), Cysteine, Geometry, Connection (principal bundle), Political science"
A5045272584,Santiago Tijaro‐Bulla,https://orcid.org/0009-0003-7408-7903,4,1,0,1,0,University of Alberta,"Genetics, Biochemistry, RNA, Computational biology, Biology, Gene, Chemistry, Guide RNA, CRISPR, Cas9, Genome, Genome editing, Subgenomic mRNA, Nucleotide, DNA, Protein biosynthesis, Genetic code, Nucleic acid, Computer vision, Computer science, Nuclear magnetic resonance, Mechanical engineering, History, Messenger RNA, Image (mathematics)"
A5045658253,Gabriele Poxleitner,,4,207,0,3,2,Center for Integrated Protein Science Munich,"Materials science, Genetics, Biochemistry, Biology, Gene, Geology, Engineering, Paleontology, Chemistry, Physics, Mutant, Aerospace engineering, Composite material, Range (aeronautics), Bacteria, Escherichia coli, Bioorthogonal chemistry, Physical therapy, Protein biosynthesis, Genetic code, Biophysics, Mutagenesis, Geochemistry, Ecology, Combinatorial chemistry"
A5045855466,Keturah A. Odoi,,4,168,0,3,3,Texas A&M University,"Biochemistry, Biology, Chemistry, Genetics, RNA, Gene, Transfer RNA, Escherichia coli, Genetic code, Amino acid, DNA, Bioorthogonal chemistry, Geometry, Copolymer, Orthogonality, Stop codon, Combinatorial chemistry, Bioconjugation, Mathematics, Linguistics, Polymerization, Nuclear magnetic resonance, Nonsense, Click chemistry, Missense mutation"
A5045977523,Hosam Abdel Aleem,,4,4,0,2,0,University of Manchester,"Mathematics, Computer science, Biology, Field (mathematics), Function (biology), Genetics, Evolutionary biology, Theoretical computer science, Cell biology, Operating system, Engineering, Programming language, Pure mathematics, Algorithm, Binary number, Expression (computer science), Arithmetic, Process (computing), Combinatorics, Discrete mathematics, Linear code, Agronomy, Algebraic number, Genetic code, Algebraic expression"
A5046081946,Camilla Ventura Santos,,4,129,0,2,2,European Molecular Biology Laboratory,"Chemistry, Biology, Physics, Materials science, Genetic code, Biophysics, Combinatorial chemistry, Genetics, Biochemistry, Click chemistry, Gene, Nanotechnology, Organic chemistry, Polymer chemistry, Amino acid, DNA, Computer science, Quantum mechanics, Computational biology, Medicine, Fluorescence, Cell biology, Operating system, Optics, Pathology"
A5046260399,Sparta Youssef-Saliba,https://orcid.org/0000-0003-2391-6460,4,21,2.5,2,1,Université Grenoble Alpes,"Biochemistry, Biology, Physics, Organic chemistry, Chemistry, Nuclear magnetic resonance, Genetics, Enzyme, Cysteine, Combinatorial chemistry, Mathematics, Medicine, Internal medicine, Endocrinology, Amino acid, Homocysteine, Methionine, Astronomy, Geometry, Finance, Genetic code, Connection (principal bundle), Earth (classical element), Food science, Mathematical physics"
A5046788478,Naama Wald,,4,69,1,3,3,Hebrew University of Jerusalem,"Genetics, Biology, Biochemistry, Gene, Chemistry, Genetic code, Bioinformatics, RNA, Computational biology, Codon usage bias, Genome, Transfer RNA, Amino acid, DNA, Algorithm, Ecology, Stop codon, Computer vision, Mathematics, Computer science, Veterinary medicine, Pipeline (software), Open reading frame, Robustness (evolution), Medicine"
A5048264434,Takahiro Ishizawa,,4,175,0,3,3,The University of Tokyo,"Genetics, Biochemistry, Biology, Chemistry, DNA, Gene, Genetic code, Computer science, Computational biology, Programming language, Amino acid, Nuclear magnetic resonance, Medicine, Selection (genetic algorithm), Operating system, Machine learning, Physics, Internal medicine, Artificial intelligence, VEGF receptors, In vitro, Cancer research, Peptide, Linker, Protein biosynthesis"
A5048515546,Romano,,4,0,0,0,0,University of Molise,"Genetics, Biochemistry, Biology, Gene, Chemistry, Ecology, Messenger RNA, Physics, Geology, Molecular biology, Protein biosynthesis, Genetic code, Stop codon, Malignant transformation, Recombinant DNA, Computer science, Nuclear magnetic resonance, Scalability, Transfection, Quantum mechanics, Computational biology, Medicine, Classical mechanics, Database, Cell culture"
A5049995597,S. S. Martinelli,,4,58,0,3,1,"Birkbeck, University of London","Biochemistry, Biology, Chemistry, Genetics, Gene, Mutant, Molecular biology, Aspergillus nidulans, Protein biosynthesis, Ribosomal protein, RNA, Ribosomal RNA, Ribosome, Geology, Phenotype, Agronomy, Genetic code, Political science, Ecology, Environmental science, Chemical engineering, Chromatography, Ultrafiltration (renal), Turbidity, Medicine"
A5050354902,Adeline Pichard-Kostuch,https://orcid.org/0000-0001-9220-8535,4,48,27,3,2,Institute of Integrative Biology of the Cell,"Genetics, Biochemistry, Biology, Gene, Chemistry, Computer science, Nuclear magnetic resonance, RNA, Computational biology, Physics, Transfer RNA, Organic chemistry, DNA, Operating system, Peptide sequence, Enzyme, Nucleotide, Amino acid, Biosynthesis, DNA polymerase, Protein biosynthesis, Eukaryotic translation, Genetic code, Biophysics, Function (biology)"
A5050439460,Christopher Latour,https://orcid.org/0000-0002-4830-6469,4,96,0,2,2,Boston College,"Biology, Biochemistry, Chemistry, Genetic code, Psychology, Anesthesia, Genetics, RNA, Medicine, Pharmacology, Gene, Psychiatry, Internal medicine, Transfer RNA, Cardiology, Neuroscience, Organic chemistry, Amino acid, Escherichia coli, DNA, Physical therapy, Directed evolution, Mutagenesis, Observational study, Toxicity"
A5051012041,Jiin-Yu Chen,,4,14,1,1,1,Johns Hopkins Berman Institute of Bioethics,"Political science, Law, Medicine, Biology, Epistemology, Philosophy, Sociology, Psychology, Theology, Economic growth, Genetics, Biochemistry, Engineering ethics, Environmental ethics, History, Gene, Psychiatry, Engineering, Economics, Chemistry, Virtue, Virtue ethics, Genetic code, Andrology, Work (physics)"
A5051110796,Rumer IuB,,4,23,0,3,1,N/A,"Computational biology, Biology, Genetic code, Computer science, Genetics, Biochemistry, Gene, Set (abstract data type), Chemistry, Programming language, Amino acid, DNA, Code (set theory), Ecology, Systematics, Taxonomy (biology), Botany, Evolutionary biology, Zoology"
A5051302568,Christin Treiber-Kleinke,,4,4,0,1,0,Freie Universität Berlin,"Genetics, Biochemistry, Biology, Gene, Geology, Paleontology, Chemistry, Amino acid, Bacteria, Escherichia coli, Tryptophan, Computational biology, Physics, Genetic code, Psychology, Bioinformatics, Regulon, Transcription factor, Promoter, Proteome, Optics, Adaptation (eye), Mutant, Gene expression, Regulation of gene expression"
A5051351719,Maria Chloupkova,,4,88,0,2,2,University of Portland,"Genetics, Biochemistry, Biology, Chemistry, Mitochondrion, Nuclear magnetic resonance, Cell biology, Gene, Physics, Molecular biology, Organic chemistry, Enzyme, Medicine, Internal medicine, Receptor, Protease, Genetic code, Mitochondrial matrix, Function (biology), Psychology, Nuclear gene, Transferrin, ATPase, Mitochondrial DNA, Transferrin receptor"
A5051614264,Marine Leclercq,https://orcid.org/0000-0002-3974-0060,4,13,6,1,1,University of Liège,"Computer science, Biology, Finance, Genetic code, Political science, Artificial neural network, Genetics, Biochemistry, Computational biology, Forestry, Gene, Deep learning, Machine learning, Sociology, Business, Molecular biology, Artificial intelligence, Library science, Economics, Set (abstract data type), Chemistry, Management, Programming language, Law, Geography"
A5051696154,Richa Gandharva,,4,7,0,1,0,N/A,"Genetics, Medicine, Biology, Internal medicine, Pathology, Infectious disease (medical specialty), Disease, Coronavirus disease 2019 (COVID-19), RNA silencing, Immune system, Genetic code, Plasmid, Theology, Biochemistry, RNA, Pandemic, Environmental health, Gene, Epidemiology, Epistemology, Outbreak, Geology, Life expectancy, Organism, Philosophy"
A5051900623,Hiroyuki Nakabayashi,,4,85,0,3,2,Tohoku University,"Quantum mechanics, Physics, Chemistry, Chemical engineering, Biology, Engineering, Nanotechnology, Organic chemistry, Materials science, Ecology, Computer science, Oceanography, Optics, Geology, Physical chemistry, Paleontology, Composite material, Particle size, Programming language, Tetraethyl orthosilicate, Particle (ecology), Astronomy, Aggregate (composite), Genetic code, Dispersity"
A5052217302,Ecaterina Cozma,https://orcid.org/0000-0003-4446-8302,4,5,0.666666667,1,0,Western University,"Genetics, Biochemistry, RNA, Biology, Gene, Transfer RNA, Chemistry, DNA, Protein biosynthesis, Genetic code, RNA-dependent RNA polymerase, Linguistics, Antitermination, Nuclear magnetic resonance, RNA polymerase II, RNA polymerase III, Polymerase, Transcription factor, Cell biology, Promoter, Physics, Philosophy, Mutant, Gene expression, Molecular biology"
A5052401666,Helena Roura Frigolé,,4,53,0,3,2,Institute for Research in Biomedicine,"Nuclear magnetic resonance, Biochemistry, Biology, Physics, Organic chemistry, Enzyme, Chemistry, Genetics, RNA, Medicine, Gene, Internal medicine, Endocrinology, Transfer RNA, Adenosine, Adenosine deaminase, DNA, Inosine, Amplicon, Genetic code, RNA-dependent RNA polymerase, Polymerase chain reaction, Bioinformatics, Computational biology, RNA polymerase III"
A5053287286,Yuting Chen,https://orcid.org/0000-0003-0436-8876,4,956,0,4,4,East China Normal University,"Genetics, Biochemistry, Computational biology, Biology, Gene, Chemistry, CRISPR, Gene targeting, Genome, Genome editing, DNA, Genetic code, Political science, Zinc finger, Transcription activator-like effector nuclease, Zinc finger nuclease, Computer science, Medicine, Gene knockout, Evolutionary biology, Transcription factor, Cell biology, History, Homologous recombination, Cas9"
A5053757206,R.J. Sheedy,,4,51,0,3,2,Queensland University of Technology,"Nuclear magnetic resonance, Biochemistry, Biology, Physics, Organic chemistry, Enzyme, Chemistry, Genetics, Ecology, Aldolase A, Computational biology, Medicine, Gene, Internal medicine, Fructose-bisphosphate aldolase, Agronomy, Genetic code, Political science, Information retrieval, Nucleic acid, Ontogeny, Computer science, Open reading frame, RNA, Polymerase"
A5054713834,Nirav Thakkar,,4,167,4,3,2,Institute of Entomology,"Genetics, Biochemistry, Biology, Gene, Chemistry, Psychology, Ecology, Circadian clock, Medicine, Physics, Circadian rhythm, Internal medicine, Endocrinology, Genome, Neuroscience, Drosophila melanogaster, Genetic code, Phosphorylation, Acoustics, Nuclear magnetic resonance, Botany, Long non-coding RNA, Quantum mechanics, RNA, Computational biology"
A5054721809,Daniela Daubert,,4,395,0,4,4,Urologische Klinik München,"Genetics, Biochemistry, Biology, Gene, Chemistry, Recombinant DNA, Molecular biology, Genetic code, Computational biology, Medicine, Physics, Antigen, Antibody, Peptide sequence, Immunology, Amino acid, DNA, Immune system, Biophysics, Immunoglobulin light chain, Computer science, Chemical engineering, Nuclear magnetic resonance, Open reading frame, Plasma protein binding"
A5055775751,R.P. Jorré,,4,19,0,2,1,The Postal Museum,"Computer science, Genetics, Biochemistry, Biology, Chemistry, Amino acid, Genetic code, Gene, Philosophy, Set (abstract data type), Programming language, DNA, Code (set theory), Humanities, Mitochondrion, Cytochrome c, Mathematics, Linguistics, Computational biology, Cell biology, Markov chain, Statistics, Machine learning, Art, Apoptosis"
A5055800998,Sandi Verbin,,4,79,0,2,1,Temple University Hospital,"Medicine, Genetics, Biology, Psychology, Political science, Computer science, Biochemistry, Gene, Chemistry, Programming language, Law, Genetic code, Dermatology, Computer network, Computer security, Linguistics, Anesthesia, Chemical engineering, Human genetics, Anatomy, Internet privacy, Operating system, Login, Internal medicine, Engineering"
A5056960307,Jeffrey Roach,,4,116,0,3,3,"University of California, Davis","Chemistry, Genetics, Biochemistry, Evolutionary biology, Biology, Gene, Genome, Computational biology, Gene expression, DNA, Gene family, Wavelength, Crystallography, Genetic code, Sequence assembly, Whole genome sequencing, Molecule, Computer science, Molecular physics, Chromatography, Phase (matter), Proteomics, Optoelectronics, DNA sequencing, Contig"
A5056988199,J. Osada,,4,46,2,2,2,Instituto de Investigación Sanitaria Aragón,"Psychology, Computer science, Biology, Mathematics, Linguistics, Biochemistry, History, Epistemology, Geology, Philosophy, Mathematics education, Paleontology, Archaeology, Chemistry, Geography, Big Five personality traits, Genetic code, Psychoanalysis, Pedagogy, Food science, Economic growth, Genetics, Apolipoprotein E, Apolipoprotein B, Computational biology"
