A5004315300,Franck V. Murphy,,1,0,0,0,0,Access,"Genetic code, Nuclear magnetic resonance, Speed wobble, Genetics, Biochemistry, Quantum mechanics, RNA, Computational biology, Stereochemistry, Classical mechanics, Biology, Ribosome, Gene, Tautomer, Physics, Transfer RNA, Medicinal chemistry, Organic chemistry, Enzyme, Base pair, Chemistry, Wobble base pair, Amino acid, DNA, Cytidine"
A5004420005,T. H. Jukes,,1,0,0,0,0,N/A,"Genetic code, Computer science, Genetics, Biochemistry, Evolutionary biology, Biology, Gene, Set (abstract data type), Chemistry, Programming language, Amino acid, DNA, Code (set theory)"
A5004795682,N U Sayyidatunnisa,,1,0,0,0,0,Padjadjaran University,"Genetic code, Nucleic acid, Mathematics, Genetics, Biochemistry, Biology, Gene, Chemistry, Nucleotide, Amino acid, DNA, Cytosine, Thymine, Guanine"
A5004991118,C. O'Neal,,1,291,0,1,1,N/A,"Genetic code, RNA editing, Computer science, Genetics, Biochemistry, RNA, Computational biology, Biology, Intron, Gene, Messenger RNA, microRNA, Gene expression, Set (abstract data type), Chemistry, Non-coding RNA, Programming language, Amino acid, DNA, Code (set theory)"
A5005057367,Hen N,,1,0,0,0,0,N/A,"Genetic code, Nucleic acid, Computer science, Genetics, Biochemistry, Computational biology, Nucleic acid sequence, Biology, Gene, Oligonucleotide, Chemistry, Amino acid, DNA, Sequence (biology)"
A5005154306,H. GOBIND KHORANA,,1,0,0,0,0,N/A,"Genetic code, Nucleic acid, Computer science, Genetics, Biochemistry, Computational biology, Biology, Gene, Set (abstract data type), Chemistry, Programming language, Amino acid, DNA, Code (set theory)"
A5005514515,Daria Kurochkina,,1,0,0,0,0,N/A,"Genetic code, Mitochondrion, Computer science, Genetics, Biochemistry, Computational biology, Biology, Cell biology, Gene, Set (abstract data type), Chemistry, Programming language, Amino acid, DNA, Code (set theory)"
A5005528420,J J Bourgarit,,1,0,0,0,0,N/A,"Finance, Genetic code, Function (biology), Mathematics, Computer science, Genetics, Biochemistry, Medicine, Evolutionary biology, Hypervariable region, Biology, Cell biology, Gene, Combinatorics, Business, Antibody, Economics, Set (abstract data type), Chemistry, Position (finance), Programming language, Immunology, Amino acid, DNA"
A5005639977,Jacques Lap,,1,11,0,1,1,Henan Academy of Agricultural Sciences,"Genetics, Biochemistry, Biology, Gene, Chemistry, Protein quaternary structure, Directed evolution, Genetic code, Function (biology), Mathematics, Multivariate analysis, Computer science, Nuclear magnetic resonance, Botany, RNA, Medicine, Backcrossing, Evolutionary biology, Selection (genetic algorithm), Cell biology, Environmental health, Protein subunit, Statistics, Machine learning, Physics"
A5005669504,Lekomtsev Sa,,1,0,0,0,0,N/A,"Genetic code, Stop codon, Genetics, Biochemistry, RNA, Biology, Codon usage bias, Ribosome, Gene, Genome, Transfer RNA, Chemistry, Amino acid, DNA, Release factor"
A5005837494,E Schwob,,1,1,0,1,0,N/A,"Genetic code, Genetics, Biochemistry, RNA, Computational biology, Biology, Gene, Aminoacylation, Transfer RNA, Chemistry, Amino acid, Escherichia coli, DNA, Aminoacyl tRNA synthetase, Glutamine"
A5006007559,T. W. Traut,,1,0,0,0,0,N/A,"Genetic code, Exon, Computer science, Genetics, Biochemistry, Computational biology, Biology, Gene, Set (abstract data type), Chemistry, Programming language, Amino acid, DNA, Code (set theory)"
A5006127376,Anna Dziegielewski,,1,5,5,1,0,N/A,"Genetic code, Nuclear magnetic resonance, Biomolecule, Genetics, Biochemistry, Bioinformatics, Computational biology, Biology, Gene, Physics, Protein engineering, Nanotechnology, Organic chemistry, Enzyme, Chemistry, Synthetic biology, Materials science, Amino acid, Escherichia coli, DNA, Nitration, Tyrosine"
A5006215894,Tina Sasaki,,1,5,0,1,0,"California State University, East Bay","Genetic code, DNA sequencing, Genetics, Biochemistry, RNA, Computational biology, Biology, Ribosome, Gene, Genome, Chemistry, Human genome, Amino acid, DNA, Sequence (biology)"
A5006388888,Alexandra Avrutis,,1,2,2,1,0,Montclair State University,"Genetic code, Biophysics, Function (biology), Psychology, Microtubule, Genetics, Biochemistry, Kinesin, Axoplasmic transport, Computational biology, Medicine, Evolutionary biology, Intracellular, Tubulin, Biology, Motor protein, Cell biology, Gene, Anatomy, Dynein, Psychiatry, Cytoskeleton, Molecular motor, Neuroscience, Nanotechnology"
A5006430267,Nazrana Sultana Begum,,1,3,2,1,0,Assam University,"Genetic code, Computer science, Genetics, Biochemistry, Computational biology, Medicine, Natural selection, Evolutionary biology, Selection (genetic algorithm), Biology, Codon usage bias, Coding region, Environmental health, Gene, Machine learning, Genome, Sociology, Demography, Artificial intelligence, Chemistry, Amino acid, DNA, Population"
A5006478569,Aloqalaa Da,,1,6,0,1,0,University of Liverpool,"Genetic code, Algorithm, Mathematics, Social science, Computer science, Source code, Genetics, Biochemistry, Robustness (evolution), Cluster analysis, Theoretical computer science, Biology, Gene, Statistics, Operating system, Combinatorics, Discrete mathematics, Machine learning, Graph, Sociology, Artificial intelligence, Coding (social sciences), Chemistry, Programming language, Amino acid"
A5006514319,T. Vacher,,1,26,0,1,1,Sorbonne Université,"Astronomy, Protein biosynthesis, Geophysics, Genetic code, Stop codon, Genetics, Biochemistry, RNA, Biology, Ribosome, Gene, Messenger RNA, Ionosphere, Physics, Geology, Translation (biology), Molecular biology, Transfer RNA, Terminator (solar), Chemistry, Amino acid, Escherichia coli, DNA, Cytosine, Tryptophan"
A5006604264,Anthony Avruch,,1,39,0,1,1,Cubist Pharmaceuticals (United States),"Genetic code, Nuclear magnetic resonance, Genetics, Biochemistry, RNA, Biology, Gene, Physics, Aminoacylation, Transfer RNA, Organic chemistry, Enzyme, Chemistry, Amino acid, Escherichia coli, DNA, Aminoacyl tRNA synthetase"
A5006626317,Janeshwar E Chezhiyan,,1,0,0,0,0,N/A,"Astronomy, Protein biosynthesis, Geophysics, Genetic code, Linguistics, Genetics, Biochemistry, RNA, Biology, Gene, Ionosphere, Physics, Geology, Philosophy, Molecular biology, Terminator (solar), Transcription (linguistics), Chemistry, Amino acid, DNA"
A5007163853,Sergei Natanzon,,1,0,0,0,0,N/A,"Genetic code, Mathematics, Mathematical physics, Computer science, Genetics, Biochemistry, Quantum mechanics, Biology, Gene, Particle physics, Supersymmetry, Physics, Set (abstract data type), Chemistry, Programming language, Amino acid, DNA, Code (set theory)"
A5007206586,Malte Henkel,,1,0,0,0,0,N/A,"Genetic code, Mathematics, Mathematical physics, Computer science, Genetics, Biochemistry, Quantum mechanics, Biology, Gene, Particle physics, Supersymmetry, Physics, Set (abstract data type), Chemistry, Programming language, Amino acid, DNA, Code (set theory)"
A5007257909,Olga Pipitone,,1,36,0,1,1,N/A,"Genetic code, Combinatorial chemistry, Recombinant DNA, Nuclear magnetic resonance, Protein structure, Genetics, Biochemistry, Computational biology, Biology, Gene, Messenger RNA, Physics, Protein engineering, Translation (biology), Biotechnology, Protein design, Peptide sequence, Organic chemistry, Enzyme, Chemistry, Photo-reactive amino acid analog, Protein catabolism, In vivo, Amino acid, DNA"
A5007763233,Caetano-AnollésGustavo,,1,0,0,0,0,N/A,"Genetic code, Mathematics, Computer science, Genetics, Biochemistry, RNA, Computational biology, Evolutionary biology, Biology, Gene, Messenger RNA, Mathematical analysis, Translation (biology), Transfer RNA, Set (abstract data type), Variable (mathematics), Chemistry, Programming language, Amino acid, DNA, Code (set theory)"
A5007784845,I.M. Katkov,,1,0,0,0,0,N/A,"Genetic code, Anthropology, Social science, Computer science, Genetics, Biochemistry, Social dynamics, Biology, Gene, Epistemology, Philosophy, Sociology, Artificial intelligence, Set (abstract data type), Chemistry, Programming language, Amino acid, DNA, Code (set theory)"
A5007996163,T. Carpenter,,1,2,0,1,0,N/A,"Finance, Genetic code, Political science, Computer science, Table (database), Genetics, Biochemistry, Computational biology, Database, Biology, Gene, Data mining, Business, Economics, Set (abstract data type), Chemistry, Programming language, Law, Amino acid, DNA, Structuring, Code (set theory)"
A5008189538,Diego Cocurullo,,1,0,0,0,0,N/A,"Genetic code, Genetics, Biochemistry, Quantum mechanics, Computational biology, Evolutionary biology, Biology, Codon usage bias, Thermodynamics, Gene, Entropy (arrow of time), Physics, Statistical physics, Engineering, Genome, Biochemical engineering, Chemistry, Biological system, Amino acid, DNA, Quantitative biology"
A5008321529,Viviana Di Giacco,,1,22,0,1,1,Max Planck Institute for Molecular Genetics,"Protein biosynthesis, Genetic code, Genetics, Shine-Dalgarno sequence, Biochemistry, RNA, Biology, Ribosome, A-site, Gene, Messenger RNA, P-site, Binding site, Translation (biology), Molecular biology, Transfer RNA, Start codon, Chemistry, Nucleotide, Amino acid, DNA, Base sequence"
A5008997658,Singer Bs,,1,152,0,1,1,N/A,"Genetic code, Stop codon, Genetics, Biochemistry, Nucleic acid sequence, Biology, Gene, Base pair, Chemistry, Mutation, Amino acid, Escherichia coli, DNA, Bacteriophage, Sequence (biology)"
A5009027450,Kimitsuna Watanabely,,1,2,0,1,0,N/A,"Genetic code, Genetics, Biochemistry, RNA, Ribosomal RNA, Computational biology, Biology, Ribosome, Gene, Transfer RNA, Chemistry, Amino acid, DNA"
A5009125933,Oskar Miekley,,1,73,0,1,1,Max Planck Institute of Colloids and Interfaces,"Protein biosynthesis, Genetic code, Frameshift mutation, Exon, Open reading frame, Genetics, Biochemistry, RNA, Ribosomal RNA, Computational biology, Biology, Ribosome, Cell biology, Translational frameshift, Gene, Messenger RNA, Phenotype, Translation (biology), Molecular biology, Transfer RNA, Peptide sequence, Chemistry, Mutation, Amino acid, DNA"
A5009150631,Barbara Zofel,,1,0,0,0,0,N/A,"Genetic code, Stop codon, Computer science, Genetics, Biochemistry, Computational biology, Selection (genetic algorithm), Biology, Gene, Machine learning, Artificial intelligence, Set (abstract data type), Chemistry, Programming language, Amino acid, DNA, Code (set theory)"
A5009316592,James Lyons Weiler,,1,0,0,0,0,N/A,"Genetic code, Nucleic acid, Genetics, Biochemistry, RNA, Computational biology, Biology, Gene, Geology, Organism, Paleontology, Molecular biology, Base pair, Chemistry, Nucleotide, Amino acid, DNA"
A5009342258,Jillyn M. Tittle,,1,0,0,0,0,University of Colorado Denver,"Genetic code, Genetics, Biochemistry, RNA, Computational biology, Biology, Codon usage bias, Gene, Messenger RNA, Genome, Translation (biology), Transfer RNA, Chemistry, Wobble base pair, Amino acid, DNA, Guanosine"
A5009432013,L E Gnilomedova,,1,0,0,0,0,N/A,"Genetics, Biochemistry, Biology, Gene, Physics, Chemistry, Astronomy, Genetic code, Polar, Nuclear magnetic resonance, Quantum mechanics, Stereochemistry, Medicine, Microbiology, Geology, Paleontology, Virology, Organic chemistry, Enzyme, Lytic cycle, Immunology, Antibiotics, Amino acid, Bacteria, DNA"
A5009472275,I. Ortega-Blake,,1,8,0,1,0,Instituto de Física La Plata,"Genetic code, Computer science, Linguistics, Genetics, Biochemistry, Quantum mechanics, Biology, History, Gene, Physics, Geology, Philosophy, Paleontology, Archaeology, Set (abstract data type), Organic chemistry, Transcription (linguistics), Chemistry, Programming language, Geography, Amino acid, DNA, Code (set theory), Context (archaeology), Group (periodic table)"
A5010047411,Avinash Khare,,1,0,0,0,0,N/A,"Genetic code, Mathematics, Mathematical physics, Computer science, Genetics, Biochemistry, Quantum mechanics, Biology, Gene, Particle physics, Supersymmetry, Physics, Set (abstract data type), Chemistry, Programming language, Amino acid, DNA, Code (set theory)"
A5010266837,True E. Gibson,,1,7,0,1,0,Oregon State University,"Bioorthogonal chemistry, Genetic code, Combinatorial chemistry, Genetics, Biochemistry, Click chemistry, Biology, Gene, Organic chemistry, Chemistry, Polymer chemistry, Materials science, Amino acid, DNA, Tetrazine"
A5010268584,Dora Zvjerković,,1,0,0,0,0,N/A,"Genetic code, Ecology, Coevolution, Computer science, Genetics, Biochemistry, Computational biology, Evolutionary biology, Biology, Gene, Messenger RNA, Geology, Translation (biology), Paleontology, Set (abstract data type), Extant taxon, Chemistry, Programming language, Amino acid, DNA, Code (set theory), Sequence (biology)"
A5010355281,Paria Asadi-Atoi,,1,14,0,1,1,Ludwig-Maximilians-Universität München,"Genetics, Biochemistry, Quantum mechanics, RNA, Computational biology, Biology, Gene, Physics, Isotope, Nuclear physics, Chemistry, Genetic code, Stable isotope ratio, Nucleic acid, Stable isotope labeling by amino acids in cell culture, Isotopic labeling, Chromatography, Proteomics, Nuclear magnetic resonance, Nuclear magnetic resonance spectroscopy, Stereochemistry, Nucleic acid structure, Mass spectrometry, Radiochemistry, Organic chemistry"
A5010411123,F. Vigneau,,1,94,0,1,1,Eurofins (France),"Genetic code, Gynecology, Polymerase chain reaction, Genetically modified organism, Genetics, Biochemistry, Computational biology, Medicine, Biology, Thermodynamics, Gene, Physics, Biotechnology, Organic chemistry, Chemistry, Amino acid, DNA, Primer (cosmetics)"
A5010865767,Maggie Eppstein,,1,2,0,1,0,University of Vermont,"Genetic representation, Genetic algorithm, Genetic code, Algorithm, Political science, Mathematics, Computer science, Genetics, Biochemistry, Medicine, Theoretical computer science, Selection (genetic algorithm), Biology, Codon usage bias, Politics, Environmental health, Gene, Messenger RNA, Evolutionary computation, Genetic programming, Knapsack problem, Machine learning, Mathematical optimization, Genome, Sociology"
A5011314177,Zohar Koren,,1,13,0,1,1,Carmel (Israel),"Genetic code, Stop codon, Direct repeat, Exon, Genetics, Biochemistry, Computational biology, Biology, Codon usage bias, Coding region, Gene, Messenger RNA, Genome, Repeated sequence, Start codon, Chemistry, Nucleotide, Amino acid, DNA, Base sequence"
A5011840291,Joe Primeau,,1,0,0,0,0,N/A,"Genetic code, Function (biology), Open reading frame, Genetics, Biochemistry, Computational biology, Evolutionary biology, Biology, Cell biology, Gene, Peptide sequence, Chemistry, Conserved sequence, Amino acid, DNA, Drosophila melanogaster, Base sequence"
A5012055410,E. Gozzi,,1,0,0,0,0,N/A,"Genetic code, Mathematics, Mathematical physics, Computer science, Genetics, Biochemistry, Quantum mechanics, Biology, Gene, Particle physics, Supersymmetry, Physics, Set (abstract data type), Chemistry, Programming language, Amino acid, DNA, Code (set theory)"
A5012145826,M V Gol'tiaev,,1,0,0,0,0,N/A,"Protein biosynthesis, Genetic code, Stop codon, Nuclear magnetic resonance, Open reading frame, Genetics, Biochemistry, RNA, Medicine, Biology, Ribosome, Gene, Messenger RNA, Physics, Internal medicine, Endocrinology, Translation (biology), Molecular biology, Transfer RNA, Peptide sequence, Organic chemistry, Enzyme, Chemistry, Amino acid, Glutathione"
A5012223632,Steffen Jockush,,1,33,0,1,1,Columbia University,"Genetic code, Function (biology), Genetics, Biochemistry, Quantum mechanics, ENCODE, RNA, Computational biology, Evolutionary biology, Biology, Fluorescence, Cell biology, Gene, Optics, Physics, Transfer RNA, Chemistry, Amino acid, DNA, Fluorophore, Aminoacyl tRNA synthetase, Amino Acyl-tRNA Synthetases, Protein evolution"
A5012479470,Nissim G. Amzallag,,1,38,0,1,1,Carmel (Israel),"Genetic code, Phosphodiester bond, Genetics, Biochemistry, RNA, Stereochemistry, Biology, Gene, Oligonucleotide, Transfer RNA, Chemistry, Nucleotide, Amino acid, DNA"
A5012635342,Yurii Nikolaevich Korystov,,1,0,0,0,0,N/A,"Geometry, Genetic code, Perspective (graphical), Stop codon, Mathematics, Computer science, Genetics, Biochemistry, Computational biology, Biology, Codon usage bias, Astrobiology, Gene, Physics, Genome, Art, Visual arts, Artificial intelligence, Chemistry, Abiogenesis, Nucleotide, Amino acid, DNA"
A5012716132,T. Lestte-Lasserre,,1,0,0,0,0,Neurocentre Magendie,"Genetic code, Computer science, Genetics, Biochemistry, Computational biology, Biology, Gene, Set (abstract data type), Chemistry, Programming language, Mutation, Amino acid, DNA, Code (set theory)"
A5012865014,T. M. Eneeva,,1,1,0,1,0,Keldysh Institute of Applied Mathematics,"Genetic code, Stop codon, Mathematics, Open reading frame, Genetics, Biochemistry, Biology, Codon usage bias, Gene, Messenger RNA, Genome, Translation (biology), Reading frame, Peptide sequence, Start codon, Chemistry, Nucleotide, Amino acid, DNA, Base sequence"
A5013200120,Olga A. Zhaksybayeva,,1,1,0,1,0,N/A,"Genetic code, Computer science, Genetics, Biochemistry, Computational biology, Biology, Gene, Set (abstract data type), Chemistry, Programming language, Transformation (genetics), Amino acid, DNA, Code (set theory)"
A5013554395,Taogeng Su,,1,0,0,0,0,China Pharmaceutical University,"Genetic code, Genetics, Biochemistry, RNA, Biology, Gene, Geology, Mutant, Paleontology, Transfer RNA, Chemistry, Amino acid, Bacteria, Escherichia coli, Archaea, DNA, Methanococcus"
A5013700813,P. Davydiuk,https://orcid.org/0000-0001-7776-869X,1,0,0,0,0,N/A,"Genetic code, Algorithm, Psychology, Political science, Mathematics, Computer science, Normative, State (computer science), Genetics, Biochemistry, Criminology, Biology, Gene, Epistemology, Philosophy, Sociology, Chemistry, Programming language, Law, Criminal law, Amino acid, DNA, Legislation, Criminal code"
A5013875357,Candace M. Motta,,1,113,0,1,1,Scripps Research Institute,"Genetic code, Genetics, Biochemistry, Biology, Cell biology, CRISPR, Transgene, Gene, Messenger RNA, Phenotype, Genome, Genome editing, Translation (biology), Chemistry, Amino acid, DNA"
A5013983803,Sara Cheli,,1,19,0,1,1,University of Siena,"Protein biosynthesis, Genetic code, Stop codon, Nucleic acid, Computer science, Genetics, Biochemistry, Bioinformatics, Computational biology, Biology, Gene, Messenger RNA, Operating system, Engineering, Translation (biology), Redundancy (engineering), Molecular biology, Chemistry, Reliability engineering, Amino acid, DNA"
A5014007372,August Bo ̈ck,,1,341,0,1,1,N/A,"Protein biosynthesis, Genetic code, Stop codon, Nuclear magnetic resonance, Genetics, Biochemistry, RNA, Medicine, Biology, Gene, Messenger RNA, Physics, Internal medicine, Endocrinology, Translation (biology), Molecular biology, Transfer RNA, Organic chemistry, Enzyme, Chemistry, Amino acid, Glutathione, DNA, Superoxide dismutase, Selenocysteine"
A5014385890,Katherine A. Leonova,,1,43,0,1,1,N/A,"Genetic code, Genetics, Biochemistry, Multicellular organism, Evolutionary biology, Biology, History, Gene, Physics, Geology, Paleontology, Archaeology, Chemistry, Geography, Amino acid, DNA, Cell, Context (archaeology)"
A5014491133,Csc Deutschland,,1,0,0,0,0,N/A,"Geometry, Genetic code, Group representation, Political science, Mathematics, Computer security, Computer science, Genetics, Biochemistry, Quantum mechanics, Scheme (mathematics), Theoretical computer science, Biology, Politics, Homogeneous space, Gene, Physics, Mathematical analysis, Algebra over a field, Exploit, Organic chemistry, Chemistry, Law, Pure mathematics, Amino acid"
A5014553365,C Debenedetto,,1,25,0,1,1,N/A,"Genetic code, Stop codon, Mitochondrial DNA, Open reading frame, Genetics, Biochemistry, Nucleic acid sequence, Biology, Codon usage bias, Coding region, Gene, Messenger RNA, Genome, Reading frame, Peptide sequence, Start codon, Chemistry, Nucleotide, Amino acid, DNA, Sequence (biology), Base sequence"
A5014584598,M. Hornos,,1,4,0,1,0,Universidade de São Paulo,"Geometry, Finance, Genetic code, Theoretical physics, Mathematics, Computer science, Symmetry group, Genetics, Biochemistry, Biology, Homogeneous space, Gene, Epistemology, Physics, Philosophy, Business, Economics, Set (abstract data type), Order (exchange), Chemistry, Programming language, Pure mathematics, Amino acid, DNA, Code (set theory)"
A5014607780,EricD. Hoffer,,1,0,0,0,0,N/A,"Genetic code, Stop codon, T arm, Genetics, Shine-Dalgarno sequence, Biochemistry, RNA, Ribosomal RNA, Biology, Codon usage bias, Ribosome, A-site, Gene, Messenger RNA, P-site, Binding site, Ribosomal binding site, Genome, Translation (biology), Transfer RNA, Start codon, Chemistry, Nucleotide, Amino acid, DNA"
A5014847251,Nicholas Westmoreland,,1,53,0,1,1,National Cancer Institute,"Genetic code, Function (biology), Mathematics, Social science, Computer science, Open reading frame, Genetics, Biochemistry, Sequence analysis, RNA, Computational biology, Evolutionary biology, Biology, Cell biology, Gene, Statistics, Sociology, Peptide sequence, Set (abstract data type), Coding (social sciences), Chemistry, Programming language, Nucleotide, Amino acid, DNA"
A5014884142,F. E. Polk,,1,0,0,0,0,N/A,"Genetic code, Relation (database), Computer science, Genetics, Biochemistry, Computational biology, Database, Evolutionary biology, Biology, Gene, Data mining, Set (abstract data type), Chemistry, Programming language, Amino acid, DNA, Code (set theory), Biological evolution"
A5015005739,John Lueck,,1,0,0,0,0,N/A,"Crystallography, Genetic code, Political science, Computer science, Genetics, Biochemistry, Computational biology, Medicine, Biology, Gene, Engineering, Pathology, Set (abstract data type), Chemistry, Programming language, Law, Amino acid, DNA, Code (set theory), Research center, Center (category theory)"
A5015318166,Severo Üchoa,,1,0,0,0,0,N/A,"Protein biosynthesis, Genetic code, Frameshift mutation, Exon, Linguistics, Open reading frame, Genetics, Biochemistry, RNA, Computational biology, Nucleic acid sequence, Biology, Ribosome, Translational frameshift, Gene, Messenger RNA, Phenotype, Philosophy, Translation (biology), Molecular biology, Peptide sequence, Transcription (linguistics), Base pair, Chemistry, Mutation"
A5015550893,Jesus M. Miro-Bueno,,1,8,0,1,0,N/A,"Genetic code, Algorithm, Nucleic acid, Electronic engineering, Mathematics, Computer science, Chromatography, Computation, Genetics, Biochemistry, Bioinformatics, Computational biology, Theoretical computer science, DNA computing, Deoxyribozyme, Biology, Gene, Statistics, Detection limit, Electrical engineering, Engineering, Logic gate, Chemistry, Synthetic biology, Programming language"
A5015787927,A. M. Zemskov,,1,0,0,0,0,Ministry of Health of the Russian Federation,"Geometry, Immune system, Genetic code, Biophysics, Transduction (biophysics), Psychology, Mathematics, Computer science, Nuclear magnetic resonance, Genetics, Biochemistry, Botany, Ternary operation, Computational biology, Medicine, Ternary complex, Biology, Gene, Epistemology, Physics, Encoding (memory), Mathematical optimization, Geology, Organism, Philosophy"
A5015799907,Van Deventer Ja,,1,4,0,1,0,Tufts University,"Genetic code, Nuclear magnetic resonance, High-throughput screening, Genetics, Biochemistry, Bioinformatics, RNA, Computational biology, Biology, Gene, Messenger RNA, Physics, Protein engineering, Translation (biology), Transfer RNA, Organic chemistry, Enzyme, Chemistry, Synthetic biology, Amino acid, DNA, Saccharomyces cerevisiae, Yeast, Aminoacyl tRNA synthetase, Amino Acyl-tRNA Synthetases"
A5016171126,О.М. Зудов,,1,0,0,0,0,N/A,"Genetic algorithm, Genetic code, Algorithm, Mathematics, Computer science, Genetics, Biochemistry, Biology, Gene, Machine learning, Mathematical optimization, Parallel computing, Set (abstract data type), Chemistry, Programming language, Amino acid, DNA, Code (set theory)"
A5016348547,V. Márquez,,1,0,0,0,0,N/A,"Genetic code, T arm, Ribosomal protein, Nuclear magnetic resonance, Genetics, Biochemistry, RNA, Ribosomal RNA, EF-Tu, Ternary complex, Biology, Ribosome, A-site, Gene, Messenger RNA, Binding site, Physics, Eukaryotic Ribosome, Translation (biology), Transfer RNA, Organic chemistry, Enzyme, Chemistry, Amino acid, DNA"
A5016363002,Maxime Venin,,1,45,0,1,1,University College Cork,"Genetic code, Algorithm, Mathematics, Computer science, Genetics, Biochemistry, Decoding methods, Computational biology, Telecommunications, Biology, Codon usage bias, Gene, Statistics, Engineering, Genome, Chemistry, Amino acid, DNA"
A5016647443,SunFeng-Jie,,1,0,0,0,0,N/A,"Genetic code, Mathematics, Computer science, Genetics, Biochemistry, RNA, Computational biology, Evolutionary biology, Biology, Gene, Messenger RNA, Mathematical analysis, Translation (biology), Transfer RNA, Set (abstract data type), Variable (mathematics), Chemistry, Programming language, Amino acid, DNA, Code (set theory)"
A5016705705,Jomel Jacinto,,1,8,0,1,0,College of Charleston,"Genetic code, RNA-binding protein, Genetics, Biochemistry, RNA, Computational biology, Biology, Gene, Messenger RNA, Translation (biology), Aminoacylation, Transfer RNA, Chemistry, Amino acid, DNA, Aminoacyl tRNA synthetase, Amino Acyl-tRNA Synthetases"
A5016708887,S Sreekumari,,1,0,0,0,0,N/A,"Genetic code, Computer science, Genetics, Biochemistry, Biology, Gene, Messenger RNA, Translation (biology), Set (abstract data type), Chemistry, Programming language, Amino acid, DNA, Code (set theory)"
A5016873494,Tonći Kero,,1,0,0,0,0,N/A,"Genetic code, Epigenetics, Genetics, Biochemistry, Biology, Gene, Chemistry, Amino acid, DNA"
A5016985895,Adeesh Nagpal,,1,0,0,0,0,N/A,"Genetic code, Algorithm, Computer network, Mathematics, Computer security, Computer science, Genetics, Biochemistry, Theoretical computer science, Biology, Gene, Operating system, Encryption, Set (abstract data type), Chemistry, Programming language, Amino acid, DNA, Code (set theory), Genetic algorithm, Binary number, Telecommunications, Arithmetic, Advanced Encryption Standard, Statistics"
