A5002645008,MÃ¥ns Ehrenberg,,2,648,0,2,2,Uppsala University,"Biology, Physics, Gaussian noise, Stochastic process, Genetic code, Algorithm, Stop codon, Sensitivity (control systems), Electronic engineering, Peptide bond, Computer vision, Mathematics, Computer science, Nuclear magnetic resonance, Control theory (sociology), Genetics, Biochemistry, Quantum mechanics, RNA, Stereochemistry, Telecommunications, Detector, Noise (video), Gene, Messenger RNA"
A5003115131,Emilia Korczmar,,2,0,0,0,0,Adam Mickiewicz University in Poznań,"Genetic code, Genetics, Biochemistry, Computational biology, Biology, Gene, Chemistry, Amino acid, DNA, Psychology, Political science, Nucleic acid, Theology, Curiosity, Theme (computing), Mathematics, Computer science, Linguistics, RNA, Social psychology, Messenger RNA, Statistics, Operating system, Variety (cybernetics), World Wide Web"
A5003162290,Abigail H. Pung,,2,0,0,0,0,Oregon State University,"Genetics, Biochemistry, Biology, Gene, Chemistry, Genetic code, Plasmid, Mathematics, RNA, Medicine, Mathematical analysis, Transfer RNA, Virology, Antibody, Conjugate, Immunology, Amino acid, Escherichia coli, DNA, Aminoacyl tRNA synthetase"
A5003469027,Theodore Voronov,,2,0,0,0,0,N/A,"Mathematics, Mathematical physics, Quantum mechanics, Physics, Genetic code, Theoretical physics, Computer science, Genetics, Biochemistry, Brane, Biology, Gene, Particle physics, Supersymmetry, Set (abstract data type), Chemistry, Programming language, Amino acid, DNA, Code (set theory)"
A5003737858,Sigeng Chen,,2,21,0,1,1,Ambrx (United States),"Psychology, Genetics, Biochemistry, Computational biology, Medicine, Biology, Pharmacology, Gene, Psychiatry, Chemistry, Drug, Genetic code, Computer science, Engineering ethics, Bioinformatics, Drug development, Drug discovery, Cell culture, Cell biology, CRISPR, Risk analysis (engineering), Engineering, Cas9, Genome, Business"
A5003841072,Man Park,,2,157,0,2,2,N/A,"Chemical engineering, Genetics, Biochemistry, Biology, Engineering, Nanomaterials, Nanotechnology, Organic chemistry, Inorganic chemistry, Chemistry, Materials science, DNA, Hydroxide, Genetic code, Algorithm, Psychology, Combinatorial chemistry, Coprecipitation, Computer network, Mathematics, Computer security, Computer science, Biomolecule, Decoding methods, Quantum mechanics"
A5004006070,Steven Duplij,,2,0,0,0,0,N/A,"Mathematics, Mathematical physics, Quantum mechanics, Physics, Genetic code, Theoretical physics, Computer science, Genetics, Biochemistry, Brane, Biology, Gene, Particle physics, Supersymmetry, Set (abstract data type), Chemistry, Programming language, Amino acid, DNA, Code (set theory)"
A5004043616,Madison Dusick,https://orcid.org/0000-0002-1958-8671,2,0,0,0,0,Western University,"Genetic code, Genetics, Biochemistry, RNA, Biology, Gene, Transfer RNA, Chemistry, Wobble base pair, Amino acid, DNA, Alanine, Bioinformatics, Proteome, Messenger RNA, Translation (biology), Aminoacyl tRNA synthetase"
A5004209620,María José Gil-Quílez,,2,20,0,1,1,Universidad de Zaragoza,"Psychology, Philosophy, Pedagogy, Mathematics, Computer science, Linguistics, Sociology, Mathematics education, Programming language, Genetic code, Humanities, Political science, Genetics, Biochemistry, Scripting language, Computational biology, Biology, Expression (computer science), History, Gene, Epistemology, Operating system, Geology, Organism, Art"
A5004243480,Leila Tatiashvili,,2,0,0,0,0,Tbilisi State University,"Biology, Chemistry, Food science, Biochemistry, Organic chemistry, Agronomy, Taste, Genetic code, Psychology, Ecology, Toxicology, Maillard reaction, Environmental science, Aflatoxin, Genetics, Botany, Complete protein, Medicine, Pollutant, Mycotoxin, History, Gene, Oceanography, Contamination, Biomass (ecology)"
A5004265749,S. A. Dugre,,2,485,0,2,2,N/A,"Genetics, Biochemistry, Computational biology, Biology, Gene, Chemistry, Genetic code, Psychology, Stem cell, Computer science, Linguistics, Physiology, Phenomenon, Bioinformatics, Cardiac electrophysiology, Quantum mechanics, Medicine, Drug discovery, Cell biology, Induced pluripotent stem cell, Epistemology, Operating system, Physics, Internal medicine, Endocrinology"
A5004501618,Donna-Joe Bigot,,2,0,0,0,0,Université de Toulouse,"Computer science, Linguistics, Biochemistry, Biology, Operating system, Philosophy, Chemistry, Space (punctuation), Genetic code, Recombinant DNA, Genetics, Bioinformatics, Computational biology, Medicine, Drug discovery, Chemical space, Gene, Human–computer interaction, Molecular biology, Antibody, Peptide sequence, Immunology, Amino acid, DNA, Sequence (biology)"
A5004769593,Brian S. Reiner,,2,2,0,1,0,Rockland Community College,"Astronomy, Geometry, Mathematics, Computer science, Magic square, Astrophysics, Quantum mechanics, Combinatorics, Physics, Square (algebra), MAGIC (telescope), Genetic code, Orthodontics, Genealogy, Genetics, Biochemistry, Medicine, Evolutionary biology, Biology, History, Gene, Epistemology, Philosophy, Set (abstract data type), Chemistry"
A5005250183,Kroon Am,,2,25,0,1,1,N/A,"Mitochondrial DNA, Genetics, Biochemistry, Biology, Gene, Chemistry, DNA, Genetic code, Stop codon, Plasmid, Recombinant DNA, Open reading frame, RNA, Ribosomal RNA, Nucleic acid sequence, Codon usage bias, Coding region, MT-RNR1, Messenger RNA, Genome, Molecular biology, Transfer RNA, Reading frame, Peptide sequence, Start codon"
A5005278914,Jianhua Zhou,,2,7,2.5,1,0,Minzu University of China,"Genetics, Biochemistry, Biology, Chemistry, Immune system, Genetic code, Translational regulation, Linguistics, Nuclear magnetic resonance, Secretion, Computational biology, Medicine, Codon usage bias, Cell biology, Cytosol, Gene, Messenger RNA, Physics, Internal medicine, Endocrinology, Innate immune system, Synonymous substitution, Philosophy, Genome, Translation (biology)"
A5005363435,Andreu Bofill,,2,44,0,2,1,Hospital del Mar Research Institute,"Biochemistry, Computational biology, Medicine, Biology, Internal medicine, Endocrinology, Chemistry, Eukaryotic translation, Transposable element, Genetic code, Psychology, Endogeny, Stop codon, Metabolomics, Chromatography, Nuclear magnetic resonance, Genetics, Bioinformatics, RNA, Stereochemistry, Drug discovery, Pharmacology, Gene, Messenger RNA, Psychiatry"
A5005662490,Gaetano Ammirato,,2,75,0,1,1,University of Naples Federico II,"Genetics, Biochemistry, Biology, Chemistry, Genetic code, Mathematics, Nuclear magnetic resonance, Computational biology, Gene, Physics, Amino acid, DNA, Crystallography, Finance, Social science, Computer science, Membrane, Protein structure, Molecular mass, Protein secondary structure, Stereochemistry, Medicine, Platelet, Coding region, Aperiodic graph"
A5005893709,Tamás Viczek,,2,31,0,2,1,N/A,"Condensed matter physics, Mathematics, Quantum mechanics, Physics, Statistical physics, Astronomy, Geometry, Thermal fluctuations, Genetic code, Psychology, Computer science, Genetics, Biochemistry, Bioinformatics, Computational biology, Classical mechanics, Evolutionary biology, Biology, Thermodynamics, Scaling, Gene, Statistics, Epistemology, Engineering, Philosophy"
A5006224794,Lucy Green,https://orcid.org/0000-0002-4385-5493,2,23,0,2,2,University of Manchester,"Genetics, Biochemistry, Computational biology, Biology, Gene, Chemistry, Directed evolution, Genetic code, Mutagenesis, Stop codon, Mathematics, Computer science, Nuclear magnetic resonance, ENCODE, Selection (genetic algorithm), Codon usage bias, Statistics, Machine learning, Physics, Genome, Mutant, Protein engineering, Artificial intelligence, Shuffling, Organic chemistry"
A5006538610,R Al-Eid,,2,0,0,0,0,N/A,"Genetics, Biochemistry, Medicine, Biology, Gene, Chemistry, DNA, Genetic code, Nucleic acid, DNA sequencing, Computational biology, Stereochemistry, Molecular Structure of Nucleic Acids: A Structure for Deoxyribose Nucleic Acid, Environmental health, Polynucleotide, Internal medicine, Genome, Pathology, Sociology, Demography, Molecular biology, Base pair, Human genome, Molecular genetics, Nucleotide"
A5006637366,Yu. B. Rumer,,2,19,0,2,1,N/A,"Genetic code, Computer science, Linguistics, Genetics, Biochemistry, Computational biology, Biology, Gene, Messenger RNA, Philosophy, Translation (biology), Set (abstract data type), Chemistry, Programming language, Amino acid, DNA, Code (set theory)"
A5007014932,Shuhei Okumura,,2,29,0,1,1,Chiba Institute of Technology,"Genetics, Biochemistry, Quantum mechanics, RNA, Biology, Gene, Messenger RNA, Physics, Translation (biology), Transfer RNA, Chemistry, Uridine, Genetic code, Phosphorylation, Biophysics, Molecule, Nuclear magnetic resonance, Speed wobble, Stereochemistry, Classical mechanics, Cell biology, Organic chemistry, Enzyme, Wobble base pair, Nucleotide"
A5007035749,Clarence F. G. Castillo,,2,7,0,2,0,Republic Polytechnic,"Ecology, Genetics, Biochemistry, Biology, Gene, Geology, Paleontology, Chemistry, Agronomy, Computer hardware, Genetic code, Model organism, Operations management, Mathematics, Computer science, Operand, Resistance (ecology), Computational biology, Medicine, Mechanical engineering, Microbiology, Arithmetic, Antibiotic resistance, Environmental health, Microbial genetics"
A5007462526,Chuyi Liu,,2,0,0,0,0,Ludwig-Maximilians-Universität München,"Genetics, Biochemistry, RNA, Biology, Gene, Chemistry, Ligase ribozyme, Genetic code, RNA editing, RNA-dependent RNA polymerase, Nuclear magnetic resonance, Computational biology, Ribozyme, Polymerase, Astrobiology, Intron, Small nuclear RNA, Messenger RNA, Physics, microRNA, Gene expression, Molecular biology, Organic chemistry, Enzyme, Abiogenesis"
A5007480628,Guido Mangiavacchi,,2,21,0,2,1,University of Siena,"Genetics, Biochemistry, Biology, Gene, Chemistry, Amino acid, Protein biosynthesis, Genetic code, Biophysics, Stop codon, Nucleic acid, Molecule, Computer science, Nuclear magnetic resonance, Protein structure, Bioinformatics, Quantum mechanics, Protein Data Bank (RCSB PDB), Computational biology, Stereochemistry, Medicine, Messenger RNA, Operating system, Protein Data Bank, Physics"
A5007512049,E. Chen,,2,251,0,1,1,N/A,"Genetic code, Mitochondrial DNA, Genetics, Biochemistry, RNA, Biology, Gene, Physics, Transfer RNA, Chemistry, Wobble base pair, Amino acid, DNA, Mitochondrion, Nuclear magnetic resonance, Speed wobble, Quantum mechanics, Classical mechanics, Codon usage bias, Cell biology, Messenger RNA, Genome, Translation (biology), Organic chemistry, Enzyme"
A5007601560,Yang Jian,,2,1,0,1,0,Westlake University,"Astronomy, Genetic code, Computer science, Astrophysics, Genetics, RNA splicing, Biochemistry, RNA, Genetic variation, Computational biology, Medicine, Evolutionary biology, Biology, Environmental health, Gene, Trait, Physics, Sociology, Demography, Chemistry, Programming language, Amino acid, DNA, Variation (astronomy), Population"
A5007802411,José Tohác,,2,8,0,2,0,University of Chile,"Genetic code, Computer science, Genetics, Biochemistry, Biology, Gene, Chemistry, Amino acid, DNA, Linguistics, Bioinformatics, RNA, Computational biology, Stereochemistry, Ribosome, Messenger RNA, Philosophy, Translation (biology), Set (abstract data type), Organic chemistry, Transcription (linguistics), Programming language, Code (set theory), Degeneracy (biology), Ring (chemistry)"
A5008543834,Mallela Shamroop Kumar,,2,0,0,0,0,N/A,"Chemistry, DNA polymerase, Genetic code, Computer science, Nuclear magnetic resonance, Genetics, Biochemistry, Computational biology, Polymerase, Biology, Gene, Messenger RNA, Physics, Translation (biology), Proofreading, Set (abstract data type), Organic chemistry, Enzyme, Programming language, Amino acid, DNA, Code (set theory)"
A5008751990,Satoshi Urata,,2,15,0,1,1,Urawa University,"Computational biology, Biology, Genetic code, Sequence space, Mathematics, Computer science, Genetics, Biochemistry, Medicine, Evolutionary biology, Fitness landscape, Environmental health, Gene, Epistemology, Discrete mathematics, Banach space, Mathematical analysis, Philosophy, Sociology, Demography, Evolvability, Chemistry, Property (philosophy), Pure mathematics, Amino acid"
A5008793387,Joern Puetz,,2,249,0,2,2,University of Strasbourg,"Genetics, Biochemistry, RNA, Computational biology, Biology, Gene, Chemistry, Protein biosynthesis, Genetic code, Function (biology), Information retrieval, Computer network, Computer science, Nuclear magnetic resonance, RNA splicing, Database, Evolutionary biology, Ribosome, Cell biology, History, Messenger RNA, Physics, Geology, Genome, microRNA"
A5009727622,Mateo Cuculić,,2,0,0,0,0,N/A,"Genetic code, Humanities, Computer science, Artificial neural network, Genetics, Biochemistry, Biology, Gene, Genetic programming, Operating system, Machine learning, Physics, Philosophy, Art, Artificial intelligence, Set (abstract data type), Chemistry, Programming language, Amino acid, Python (programming language), DNA, Code (set theory), Software, C programming language"
A5010144316,Kimberly Wojcik,,2,62,0,1,1,University of Notre Dame,"Genetics, Biochemistry, Biology, Gene, Chemistry, DNA, Immune system, Genetic code, Recombinant DNA, Computer science, Polymerase chain reaction, Computational biology, Medicine, Coding region, Operating system, Gene conversion, Physics, Engineering, Southern blot, Genotype, Genome, Pathology, Antigen, Redundancy (engineering), Molecular biology"
A5010180980,F. Moron,,2,5,0,1,0,N/A,"Genetics, Biochemistry, Biology, Gene, Chemistry, DNA, Genetic code, Ecology, Nucleic acid, Computer science, Linguistics, Source code, RNA, Computational biology, Zoology, Mitosis, Cell biology, Homologous recombination, Operating system, Mitotic crossover, Philosophy, Mutant, Ploidy, Recombination, Point mutation"
A5011050794,Christina Hölzl,,2,0,0,0,0,AbbVie (Germany),"Genetics, Biochemistry, RNA, Biology, Gene, Chemistry, Ligase ribozyme, Genetic code, RNA editing, RNA-dependent RNA polymerase, Nuclear magnetic resonance, Computational biology, Ribozyme, Polymerase, Astrobiology, Intron, Small nuclear RNA, Messenger RNA, Physics, microRNA, Gene expression, Molecular biology, Organic chemistry, Enzyme, Abiogenesis"
A5011693928,Frédéric Savard,,2,80,0,1,1,Université Laval,"Genetics, Biochemistry, Biology, Gene, Chemistry, Genetic code, Psychology, Endogeny, Circadian clock, Botany, RNA, Chloroplast, Medicine, Photosystem II, Codon usage bias, Cell biology, Messenger RNA, Circadian rhythm, Internal medicine, Endocrinology, Genome, Mutant, Gene expression, Molecular biology, Transfer RNA"
A5011833062,K Kazimierski,,2,1,0,1,0,N/A,"Computer science, Biology, Physics, Astronomy, Geometry, Genetic code, Golden ratio, Earth (classical element), Mathematics, Mathematical physics, Astrophysics, Planet, Genetics, Biochemistry, Computational biology, Astrobiology, Coding region, Gene, Operating system, Combinatorics, Discrete mathematics, Engineering, Redundancy (engineering), Fibonacci number, Set (abstract data type)"
A5012135346,Javiera Díaz-Valdés,,2,2,0,1,0,University of Chile,"Linguistics, Biology, Philosophy, Genetic code, Psychoanalysis, Psychology, Political science, Anthropology, Stop codon, Alternation (linguistics), Social science, Open reading frame, Genetics, Biochemistry, Clinical psychology, Medicine, Thematic analysis, Social psychology, Phylogenetics, Politics, History, Gene, Messenger RNA, Psychiatry, Geology"
A5012200659,Wang Guang-cha,,2,1,0,1,0,China Tobacco,"Computer science, Biology, Process (computing), Operating system, Programming language, Meta-optimization, Cultural algorithm, Genetic representation, Agronomy, Genetic algorithm, Genetic operator, Genetic code, Algorithm, Operator (biology), Political science, Process engineering, Mathematics, Environmental science, Stem-and-leaf display, Genetics, Biochemistry, Botany, Particle swarm optimization, Transcription factor, Gene"
A5012705843,S. Bozinovski,,2,1,0,1,0,N/A,"Biology, Partition (number theory), Astronomy, Genetic code, Algorithm, Psychology, Political science, Ecology, Mathematics, Computer science, Genetics, Biochemistry, Taxonomy (biology), Botany, Theoretical computer science, Zoology, Politics, Gene, Automaton, Combinatorics, Discrete mathematics, Physics, Artificial intelligence, Finite-state machine, Set (abstract data type)"
A5012843817,Benjamin V Chartier,,2,25,3,2,1,University Surgical Associates,"Nuclear magnetic resonance, Genetics, Biochemistry, Medicine, Biology, Cell biology, Physics, Organic chemistry, Enzyme, Chemistry, Amino acid, Cysteine, Genetic code, Phosphorylation, Stop codon, Recombinant DNA, RNA, Gene, Messenger RNA, Internal medicine, Endocrinology, Pathology, Translation (biology), Transfer RNA, Alternative medicine"
A5012898282,Henry Rzepa,,2,0,0,0,0,N/A,"Mathematics, Computer science, Linguistics, Genealogy, Genetics, Biochemistry, Biology, History, Gene, Combinatorics, Philosophy, Base pair, Chemistry, DNA, Geometry, Genetic code, Connection (principal bundle), Political science, Theoretical physics, Social science, Base (topology), Structural engineering, Mechanical engineering, Molecular Structure of Nucleic Acids: A Structure for Deoxyribose Nucleic Acid, Statistics"
A5013152743,P.-O. Loewdin,,2,0,0,0,0,University of Florida,"Genetics, Biochemistry, Quantum mechanics, Biology, Gene, Physics, Chemistry, DNA, Genetic code, Condensed matter physics, Molecule, Computer science, Optoelectronics, Proton, Computational biology, Hydrogen bond, Stability (learning theory), Machine learning, Quantum tunnelling, Set (abstract data type), Organic chemistry, Nuclear physics, Materials science, Programming language, Mutation"
A5013865921,Jelena Ivčević,,2,0,0,0,0,N/A,"Genetics, Biochemistry, Biology, Physics, Geology, Chemistry, Genetic code, Biophysics, Psychology, Cell adhesion molecule, Transmembrane protein, Molecule, Epigenetics, Quantum mechanics, Histone, Computational biology, Medicine, Evolutionary biology, Adhesion, Cell adhesion, Cell biology, Gene, Glycoprotein, Epigenome, Optics"
A5014046901,David Bruchlen,,2,0,0,0,0,Institute for Molecular and Cellular Biology,"Genetics, Botany, Biology, Microbiology, Philosophy, Chemistry, Candida albicans, Genetic code, Function (biology), Model organism, Biochemistry, Quantum mechanics, RNA, Computational biology, Evolutionary biology, Ribosome, Mechanism (biology), Cell biology, Gene, Messenger RNA, Epistemology, Physics, Geology, Organism, Translation (biology)"
A5014303765,Paula Dadalti,,2,32,0,2,1,Fundação Bio Rio,"Nucleic acid, Genetics, Biochemistry, RNA, Medicine, Biology, Cell biology, Gene, Fungal prion, Internal medicine, Phenotype, Pathology, Chemistry, Saccharomyces cerevisiae, Disease, Yeast, Prion protein, Transmission (telecommunications), Genetic code, Function (biology), Computer science, Computational biology, Telecommunications, Evolutionary biology, Electrical engineering"
A5014854907,Susumu Morimoto,,2,6,0,1,0,Osaka Prefectural Education Center,"Genetic code, Computer science, Table (database), Genetics, Biochemistry, Database, Biology, Gene, Physics, Data mining, Chemistry, Amino acid, DNA, Acoustics, Mathematics, Binary number, Quantum mechanics, RNA, Computational biology, Medicine, Molecular Structure of Nucleic Acids: A Structure for Deoxyribose Nucleic Acid, Arithmetic, Combinatorics, Periodic table, Mutant"
A5015625215,Andy Collins-Hed,,2,0,0,0,0,"University of California, Merced","DNA polymerase, Genetic code, Computer science, Linguistics, Nuclear magnetic resonance, Genetics, Biochemistry, RNA, Computational biology, Medicine, Selection (genetic algorithm), Polymerase, Biology, Fitness landscape, Environmental health, Gene, Messenger RNA, Machine learning, Physics, Philosophy, Sociology, Translation (biology), Demography, Aminoacylation, Transfer RNA"
A5015665032,Regan Flynn,,2,21,2,2,1,Harvard University,"Genetic code, Genetics, Biochemistry, RNA, Computational biology, Biology, Gene, Genome, Transfer RNA, Chemistry, Amino acid, DNA, Medicine, Cell culture, Messenger RNA, Viral replication, Translation (biology), Virology, Immunology, Virus"
A5015686606,Massimo Bianchi,,2,0,0,0,0,N/A,"Mathematics, Mathematical physics, Quantum mechanics, Physics, Genetic code, Theoretical physics, Computer science, Genetics, Biochemistry, Brane, Biology, Gene, Particle physics, Supersymmetry, Set (abstract data type), Chemistry, Programming language, Amino acid, DNA, Code (set theory)"
A5016030185,Gautam Hathiwala,https://orcid.org/0000-0001-7187-9903,2,0,0,0,0,Marwadi University,"Computer science, Genetics, Biochemistry, Biology, Gene, Chemistry, Fuzzy logic, Mathematics, Linguistics, Computational biology, Philosophy, Artificial intelligence, Geometry, Genetic code, Perspective (graphical), GC-content, RNA, Medicine, Environmental health, Epidemiology, Operating system, Combinatorics, Electrical engineering, Internal medicine, Engineering"
A5016082650,Dimitry Leites,,2,0,0,0,0,N/A,"Mathematics, Mathematical physics, Quantum mechanics, Physics, Genetic code, Theoretical physics, Computer science, Genetics, Biochemistry, Brane, Biology, Gene, Particle physics, Supersymmetry, Set (abstract data type), Chemistry, Programming language, Amino acid, DNA, Code (set theory)"
A5016149541,Dolors Amorós-Moya,,2,57,0,2,2,University of Münster,"Psychology, Computer science, Genetics, Biochemistry, Medicine, Selection (genetic algorithm), Biology, Codon usage bias, Phylogenetics, Horizontal gene transfer, Environmental health, Gene, Machine learning, Optics, Physics, Adaptation (eye), Genome, Sociology, Demography, Artificial intelligence, Neuroscience, Chemistry, Phylogenetic tree, Population, Genetic code"
A5016567443,András T. Cook,,2,64,18.5,1,1,J. Craig Venter Institute,"Genetics, Biochemistry, Computational biology, Biology, Cell biology, Gene, Philosophy, Chemistry, DNA, Genetic code, Biophysics, Political science, Cell cycle, Theoretical physics, Computer science, Linguistics, RNA, Medicine, DNA replication, Ribosome, Messenger RNA, Epistemology, Physics, Cancer, Internal medicine"
A5016757225,Uday Bhaskar,,2,0,0,0,0,Indian Navy,"Political science, Mathematics, Genetic code, Algorithm, Computer network, Computer security, Computer science, Binary number, Genetics, Biochemistry, Telecommunications, Theoretical computer science, Biology, Arithmetic, Gene, Statistics, Operating system, Engineering, Gray code, Mathematical economics, Encryption, Economics, Set (abstract data type), Chemistry, Programming language"
A5016884513,Frank Truong,,2,36,0,1,1,California Institute of Technology,"Genetics, Biochemistry, Biology, Gene, Organic chemistry, Chemistry, Amino acid, Physical therapy, Protein sequencing, Genetic code, Auxotrophy, Sequence space, Mathematics, Computer science, Nuclear magnetic resonance, Bioinformatics, Computational biology, Medicine, Drug discovery, Chemical space, Anatomy, Discrete mathematics, Physics, Internal medicine, Banach space"
A5017458478,Kowalczykowski Sc,,2,179,0,1,1,N/A,"Genetics, Biochemistry, Biology, Gene, Chemistry, DNA, Genetic code, Protein filament, Ubiquitin, Mathematics, Computer science, Computational biology, Transcription factor, DNA-binding protein, Homologous recombination, Statistics, Replication protein A, Physics, Geology, Ubiquitin ligase, DNA repair, DDB1, DNA damage, Paleontology, Molecular biology"
A5017651809,Суслов Валентин Владимирович,,2,3,0,1,0,N/A,"Geology, Genetic code, Psychology, Model organism, Mathematics, Computer science, Genetics, Biochemistry, Computational biology, Evolutionary biology, Biology, Gene, Statistics, Encoding (memory), Organism, Genome, Paleontology, Artificial intelligence, Neuroscience, Cognitive psychology, Chemistry, Amino acid, DNA, Realization (probability)"
A5017659423,Jürgen Fuchs,,2,0,0,0,0,N/A,"Mathematics, Mathematical physics, Quantum mechanics, Physics, Genetic code, Theoretical physics, Computer science, Genetics, Biochemistry, Brane, Biology, Gene, Particle physics, Supersymmetry, Set (abstract data type), Chemistry, Programming language, Amino acid, DNA, Code (set theory)"
A5017730968,Morgan Troiano,,2,2,0,1,0,College of Charleston,"Protein biosynthesis, Genetic code, Nucleic acid, Translational regulation, Genetics, Biochemistry, RNA, Computational biology, Medicine, Biology, Gene, Messenger RNA, RNA extraction, Pathology, Translation (biology), Gene expression, Molecular biology, Transfer RNA, Chemistry, Amino acid, DNA, Mycobacterium smegmatis, Mycobacterium tuberculosis, Tuberculosis"
A5017797110,Cristina Gonzalez Moran,,2,1,0,0,0,Universidad de Oviedo,"Political science, Computer science, Biology, Law, Genetic code, Psychology, International economics, Ecology, Pedagogy, Transport engineering, Melody, Genetics, Biochemistry, Quantum mechanics, The arts, Thermodynamics, Gene, Economic policy, Lifelong learning, Engineering management, Physics, Literature, Engineering, Art, Sociology"
A5018009182,Johannes N. Singer,,2,0,0,0,0,Ludwig-Maximilians-Universität München,"Genetics, Biochemistry, RNA, Biology, Gene, Chemistry, Ligase ribozyme, Genetic code, RNA editing, RNA-dependent RNA polymerase, Nuclear magnetic resonance, Computational biology, Ribozyme, Polymerase, Astrobiology, Intron, Small nuclear RNA, Messenger RNA, Physics, microRNA, Gene expression, Molecular biology, Organic chemistry, Enzyme, Abiogenesis"
A5018233175,Jimmitti Teysir,,2,0,0,0,0,Hauptman-Woodward Medical Research Institute,"Genetics, Biochemistry, Biology, Gene, Chemistry, Genetic code, Stop codon, Ribosomal protein, 16S ribosomal RNA, GC-content, Open reading frame, RNA, Ribosomal RNA, Chloroplast, Computational biology, Missense mutation, Codon usage bias, Ribosome, Coding region, Nonsense mutation, Geology, Phenotype, Genome, Paleontology, Reading frame"
